{
 "schema_version": "1.0",
 "report_type": "intraday",
 "trigger": "schedule",
 "urgent": false,
 "date": "2026-10-22",
 "generated_at": "2026-10-22T05:37:47.997Z",
 "generated_by": "ci",
 "status": "degraded",
 "track": "A",
 "data_health": {
  "sources": {
   "dual_track": "fresh",
   "signals": "fresh",
   "global": "fresh",
   "backtest": "fresh",
   "ops_alerts": "fresh",
   "intraday": "fresh",
   "paper_account": "missing"
  }
 },
 "data_completeness": {
  "date": {
   "source": "derived",
   "confidence": "measured"
  },
  "grid_triggers": {
   "source": "missing",
   "confidence": "missing"
  },
  "counter_trend_losses": {
   "source": "missing",
   "confidence": "missing"
  },
  "pnl_daily": {
   "source": "archived",
   "confidence": "measured"
  },
  "pnl_cumulative": {
   "source": "archived",
   "confidence": "measured"
  },
  "max_drawdown_daily": {
   "source": "missing",
   "confidence": "missing"
  },
  "trend_switch_hits": {
   "source": "archived",
   "confidence": "measured"
  },
  "cost_ratio": {
   "source": "missing",
   "confidence": "missing"
  },
  "slippage_avg": {
   "source": "assumed",
   "confidence": "assumed"
  },
  "slippage_source": {
   "source": "derived",
   "confidence": "measured"
  },
  "regime": {
   "source": "archived",
   "confidence": "measured"
  },
  "circuit_breaker": {
   "source": "archived",
   "confidence": "measured"
  },
  "overseas": {
   "source": "archived",
   "confidence": "measured"
  },
  "nav_realtime": {
   "source": "missing",
   "confidence": "missing"
  },
  "approx": {
   "source": "derived",
   "confidence": "measured"
  },
  "drawdown_vs_threshold": {
   "source": "derived",
   "confidence": "measured"
  },
  "simulation_stock": {
   "source": "derived",
   "confidence": "measured"
  },
  "ma20_degraded": {
   "source": "derived",
   "confidence": "measured"
  }
 },
 "payload": {
  "date": "2026-10-16",
  "grid_triggers": null,
  "counter_trend_losses": null,
  "pnl_daily": 0.00006,
  "pnl_cumulative": -0.028334,
  "max_drawdown_daily": null,
  "trend_switch_hits": 1,
  "cost_ratio": null,
  "slippage_avg": 0.0002,
  "slippage_source": "assumed_constant",
  "regime": {
   "key": "recover",
   "label": "回暖",
   "cap": 0.5,
   "position_range": "30%~50%"
  },
  "circuit_breaker": {
   "dd_tier": null,
   "hard_stop_triggered": null,
   "risk_events": 0,
   "note": "归档轨无账户日内回撤与止损记录，档位未知；ops-alerts 事件计数如上"
  },
  "overseas": [
   {
    "key": "a50",
    "name": "富时中国A50期货",
    "chgPct": 0.00296,
    "state": "ok"
   },
   {
    "key": "sox",
    "name": "费城半导体指数",
    "chgPct": 0.019651000000000002,
    "state": "ok"
   }
  ],
  "nav_realtime": null,
  "approx": false,
  "drawdown_vs_threshold": {
   "dd_now": 0.149031,
   "tier_edges": [
    0.09,
    0.15
   ],
   "distance_pp": 0.1,
   "basis": "归档轨 trackA.maxDd（运行回撤，非当日）"
  },
  "simulation_stock": {
   "sentiment_cycle": {
    "phase": "fermentation",
    "phase_label": "发酵期",
    "regime_raw": "recover",
    "phase_source": "regime=recover · 分位 62.7 · 方向 up（recover 细分阈值 <30 为启动期）",
    "limit_up_count": 61,
    "highest_chain": 6,
    "broken_limit_ratio": 0.44545454545454544,
    "yesterday_chain_performance": 1.3,
    "warning_signals": [
     "昨涨停今日翻绿 49%、高位板晋级失败 40%，追高盈亏各半",
     "大面 4 只：澳弘电子 -10%、协和电子 -10%、雪龙集团 -9.98%、中新赛克 -8.65%"
    ]
   },
   "position_suggestion": "neutral",
   "pool_basis": "pain.advance.detail 连板活跃明细按连板数降序（情绪面规则现算，决议 8：人工输入模式的辅助建议，可一键采纳不自动生效）",
   "candidate_pool": [
    {
     "code": "600825",
     "name": "新华传媒",
     "themes": null,
     "selection_reason": "6 连板（当日 9.99%，晋级成功，近期上榜 11 次）",
     "intraday_chg": null,
     "fundamentals": {
      "roe": null,
      "revenue_growth": null,
      "net_profit_growth": null,
      "pe": null,
      "pb": null,
      "peg": null,
      "market_cap": null,
      "moat_note": null
     },
     "fund_flow_note": "游资/其他（营业部·分公司·自营）主导（席位级：instNet/northNet/hotNet 真值；个股级主力净流入系统无数据）",
     "scripts": [
      {
       "name": "A",
       "trigger_condition": "高开 >2% 或放量突破昨收上沿（600825，即时轨实时价判定）",
       "position_ratio": 0.5,
       "stop_loss": -0.08,
       "take_profit": 0.16,
       "invalid_condition": "低开 >3% 或午前跌破昨收 -2%",
       "script_source": "template"
      },
      {
       "name": "B",
       "trigger_condition": "平开震荡：回踩 5 日线缩量企稳（即时轨实时价判定）",
       "position_ratio": 0.25,
       "stop_loss": null,
       "take_profit": null,
       "invalid_condition": "放量跌破 5 日线（止损为条件位，非固定百分比，故 stop_loss=null 不造数）",
       "script_source": "template"
      },
      {
       "name": "C",
       "trigger_condition": "低开/竞价弱：观望或轻仓反核（情绪冰点逆势位）",
       "position_ratio": 0.1,
       "stop_loss": -0.05,
       "take_profit": null,
       "invalid_condition": "断板次日翻绿或 seats 转机构撤离",
       "script_source": "template"
      }
     ],
     "risks": [
      "6 板高位，连板晋级失败率 40%"
     ]
    },
    {
     "code": "603949",
     "name": "雪龙集团",
     "themes": null,
     "selection_reason": "4 连板（当日 -9.98%，晋级失败，近期上榜 7 次）",
     "intraday_chg": null,
     "fundamentals": {
      "roe": null,
      "revenue_growth": null,
      "net_profit_growth": null,
      "pe": null,
      "pb": null,
      "peg": null,
      "market_cap": null,
      "moat_note": null
     },
     "fund_flow_note": "游资/其他（营业部·分公司·自营）主导（席位级：instNet/northNet/hotNet 真值；个股级主力净流入系统无数据）",
     "scripts": [
      {
       "name": "A",
       "trigger_condition": "高开 >2% 或放量突破昨收上沿（603949，即时轨实时价判定）",
       "position_ratio": 0.5,
       "stop_loss": -0.08,
       "take_profit": 0.16,
       "invalid_condition": "低开 >3% 或午前跌破昨收 -2%",
       "script_source": "template"
      },
      {
       "name": "B",
       "trigger_condition": "平开震荡：回踩 5 日线缩量企稳（即时轨实时价判定）",
       "position_ratio": 0.25,
       "stop_loss": null,
       "take_profit": null,
       "invalid_condition": "放量跌破 5 日线（止损为条件位，非固定百分比，故 stop_loss=null 不造数）",
       "script_source": "template"
      },
      {
       "name": "C",
       "trigger_condition": "低开/竞价弱：观望或轻仓反核（情绪冰点逆势位）",
       "position_ratio": 0.1,
       "stop_loss": -0.05,
       "take_profit": null,
       "invalid_condition": "断板次日翻绿或 seats 转机构撤离",
       "script_source": "template"
      }
     ],
     "risks": [
      "昨日 4 板已晋级失败（chg -9.98%），反核属逆势剧本"
     ]
    },
    {
     "code": "000678",
     "name": "襄阳轴承",
     "themes": null,
     "selection_reason": "3 连板（当日 9.98%，晋级成功，近期上榜 7 次）",
     "intraday_chg": null,
     "fundamentals": {
      "roe": null,
      "revenue_growth": null,
      "net_profit_growth": null,
      "pe": null,
      "pb": null,
      "peg": null,
      "market_cap": null,
      "moat_note": null
     },
     "fund_flow_note": "游资/其他（营业部·分公司·自营）主导（席位级：instNet/northNet/hotNet 真值；个股级主力净流入系统无数据）",
     "scripts": [
      {
       "name": "A",
       "trigger_condition": "高开 >2% 或放量突破昨收上沿（000678，即时轨实时价判定）",
       "position_ratio": 0.5,
       "stop_loss": -0.08,
       "take_profit": 0.16,
       "invalid_condition": "低开 >3% 或午前跌破昨收 -2%",
       "script_source": "template"
      },
      {
       "name": "B",
       "trigger_condition": "平开震荡：回踩 5 日线缩量企稳（即时轨实时价判定）",
       "position_ratio": 0.25,
       "stop_loss": null,
       "take_profit": null,
       "invalid_condition": "放量跌破 5 日线（止损为条件位，非固定百分比，故 stop_loss=null 不造数）",
       "script_source": "template"
      },
      {
       "name": "C",
       "trigger_condition": "低开/竞价弱：观望或轻仓反核（情绪冰点逆势位）",
       "position_ratio": 0.1,
       "stop_loss": -0.05,
       "take_profit": null,
       "invalid_condition": "断板次日翻绿或 seats 转机构撤离",
       "script_source": "template"
      }
     ],
     "risks": [
      "3 板高位，连板晋级失败率 40%"
     ]
    },
    {
     "code": "002912",
     "name": "中新赛克",
     "themes": null,
     "selection_reason": "2 连板（当日 -8.65%，晋级失败，近期上榜 9 次）",
     "intraday_chg": null,
     "fundamentals": {
      "roe": null,
      "revenue_growth": null,
      "net_profit_growth": null,
      "pe": null,
      "pb": null,
      "peg": null,
      "market_cap": null,
      "moat_note": null
     },
     "fund_flow_note": "游资/其他（营业部·分公司·自营）主导（席位级：instNet/northNet/hotNet 真值；个股级主力净流入系统无数据）",
     "scripts": [
      {
       "name": "A",
       "trigger_condition": "高开 >2% 或放量突破昨收上沿（002912，即时轨实时价判定）",
       "position_ratio": 0.5,
       "stop_loss": -0.08,
       "take_profit": 0.16,
       "invalid_condition": "低开 >3% 或午前跌破昨收 -2%",
       "script_source": "template"
      },
      {
       "name": "B",
       "trigger_condition": "平开震荡：回踩 5 日线缩量企稳（即时轨实时价判定）",
       "position_ratio": 0.25,
       "stop_loss": null,
       "take_profit": null,
       "invalid_condition": "放量跌破 5 日线（止损为条件位，非固定百分比，故 stop_loss=null 不造数）",
       "script_source": "template"
      },
      {
       "name": "C",
       "trigger_condition": "低开/竞价弱：观望或轻仓反核（情绪冰点逆势位）",
       "position_ratio": 0.1,
       "stop_loss": -0.05,
       "take_profit": null,
       "invalid_condition": "断板次日翻绿或 seats 转机构撤离",
       "script_source": "template"
      }
     ],
     "risks": [
      "昨日 2 板已晋级失败（chg -8.65%），反核属逆势剧本"
     ]
    },
    {
     "code": "600032",
     "name": "浙江新能",
     "themes": null,
     "selection_reason": "2 连板（当日 -5.75%，晋级失败，近期上榜 11 次）",
     "intraday_chg": null,
     "fundamentals": {
      "roe": null,
      "revenue_growth": null,
      "net_profit_growth": null,
      "pe": null,
      "pb": null,
      "peg": null,
      "market_cap": null,
      "moat_note": null
     },
     "fund_flow_note": "游资/其他（营业部·分公司·自营）主导（席位级：instNet/northNet/hotNet 真值；个股级主力净流入系统无数据）",
     "scripts": [
      {
       "name": "A",
       "trigger_condition": "高开 >2% 或放量突破昨收上沿（600032，即时轨实时价判定）",
       "position_ratio": 0.5,
       "stop_loss": -0.08,
       "take_profit": 0.16,
       "invalid_condition": "低开 >3% 或午前跌破昨收 -2%",
       "script_source": "template"
      },
      {
       "name": "B",
       "trigger_condition": "平开震荡：回踩 5 日线缩量企稳（即时轨实时价判定）",
       "position_ratio": 0.25,
       "stop_loss": null,
       "take_profit": null,